id,likes,replies,retweets,text,url,user,rating
858957592046993408,63628,5548,123430,What senseless waste. Why kill such a gentle creature? For 'sport'?!? RT if u want global ban on all trophy hunting pic.twitter.com/uEYQdPoMsq,/eduardo_LACS/status/858957592046993408,eduardo_LACS,64202.0
858957592046993408,63628,5548,123430,What senseless waste. Why kill such a gentle creature? For 'sport'?!? RT if u want global ban on all trophy hunting pic.twitter.com/uEYQdPoMsq,/eduardo_LACS/status/858957592046993408,eduardo_LACS,64202.0
858957592046993408,63628,5548,123430,What senseless waste. Why kill such a gentle creature? For 'sport'?!? RT if u want global ban on all trophy hunting pic.twitter.com/uEYQdPoMsq,/eduardo_LACS/status/858957592046993408,eduardo_LACS,64202.0
780809121314504704,35337,1040,16364,Democracy is not a spectator sport. Don't give up your power to shape the future of the country we love. Vote: http://www.vote.gov ,/POTUS44/status/780809121314504704,POTUS44,17580.3333333
881834360827240448,4052,1028,11322,"What senseless waste. Why would you kill such a gentle creature? For 'sport'?!? 

Please RT if you want a global ban on ALL trophy hunting. pic.twitter.com/kdFUNjentf",/Protect_Wldlife/status/881834360827240448,Protect_Wldlife,5467.33333333
734744942904479744,11864,221,2441,The Summer of Sport: Football Nouveau - OR x Nikelab. With @olivierrousteing for @dazed #dreamteam pic.twitter.com/DOkqFab7JW,/Cristiano/status/734744942904479744,Cristiano,4842.0
833100799899205632,3702,2928,5649," Sport Gloves | Maze Giveaway

* RT & Follow
* Notifications ON + Proof
* GO: http://bit.ly/2kUHx7q 

Winner in 24 Hours!pic.twitter.com/9ow07To4ue",/skinhub/status/833100799899205632,skinhub,4093.0
798346876617637888,7527,22,3195,"A love for the sport. A thirst to be better than you were the day before. That's why I do it. Not for me, or anyone else. All glory to him pic.twitter.com/OuYGhNZ40t",/GoSydGo/status/798346876617637888,GoSydGo,3581.33333333
798346876617637888,7527,22,3195,"A love for the sport. A thirst to be better than you were the day before. That's why I do it. Not for me, or anyone else. All glory to him pic.twitter.com/OuYGhNZ40t",/GoSydGo/status/798346876617637888,GoSydGo,3581.33333333
850859253124521985,5330,24,3245,This Nigga playing the wrong sport with that baseball slide pic.twitter.com/g9SZ8hJcvH,/BlackPplVines/status/850859253124521985,BlackPplVines,2866.33333333
731974744979820544,3798,78,3670,And people say baseball isn't a contact sport... pic.twitter.com/qVYuHJ0G9q,/BsbLifestyle__/status/731974744979820544,BsbLifestyle__,2515.33333333
731974744979820544,3798,78,3670,And people say baseball isn't a contact sport... pic.twitter.com/qVYuHJ0G9q,/BsbLifestyle__/status/731974744979820544,BsbLifestyle__,2515.33333333
891416215880683520,3281,126,3003,Barcelona paper Sport: Neymar delaying PSG move so dad picks up £23m loyalty bonus on Monday. Dad's been paid more than Messi since 2013,/SkyKaveh/status/891416215880683520,SkyKaveh,2136.66666667
844723516964569089,3602,7,2717,Soccer is much more than just a sport https://twitter.com/20151115hime/status/844329171929190406/video/1 …,/TrueSoccerLife/status/844723516964569089,TrueSoccerLife,2108.66666667
702995514569064448,3771,17,1974,"You say Home, We say Hogwarts.
You say Sport, We say Quidditch.
You say Jail, We say Azkaban.
You say Forever, We say Always.",/HogwartsLogic/status/702995514569064448,HogwartsLogic,1920.66666667
868243927677018112,4444,68,817,Team is everything in this sport pic.twitter.com/BB5bkJNobe,/mosesbread72/status/868243927677018112,mosesbread72,1776.33333333
874019773377462272,3449,138,990,Soccer is the only sport I like. Now you know,/rudymancuso/status/874019773377462272,rudymancuso,1525.66666667
874019773377462272,3449,138,990,Soccer is the only sport I like. Now you know,/rudymancuso/status/874019773377462272,rudymancuso,1525.66666667
685581552928075776,2283,27,1677,"This is George. He's 9 & has cerebral palsy, but that doesn't stop him from playing the sport he loves. 
pic.twitter.com/6G3VguWi4o",/GeniusFootball/status/685581552928075776,GeniusFootball,1329.0
685581552928075776,2283,27,1677,"This is George. He's 9 & has cerebral palsy, but that doesn't stop him from playing the sport he loves. 
pic.twitter.com/6G3VguWi4o",/GeniusFootball/status/685581552928075776,GeniusFootball,1329.0
726179095533363200,2557,22,1369,"Del Piero on Leicester: ""It shows that nothing is impossible in sport."" #UCLpic.twitter.com/bO5qA6uYDV",/ChampionsLeague/status/726179095533363200,ChampionsLeague,1316.0
929136573727289344,2636,28,905,So glad the NCAA rulebook can protect the sport from dangers like this. No place in college hoops for a person who'd play in a church league rec game https://twitter.com/Joseph_Duarte/status/929132113919664134 …,/davidubben/status/929136573727289344,davidubben,1189.66666667
766665528437944320,2639,10,590,What a great day for Indian sport. Young girls and boys everywhere have a new idol. And this one is just getting started. Salute #PVSindhu,/Actor_Siddharth/status/766665528437944320,Actor_Siddharth,1079.66666667
821853869588316160,1895,56,1233,Gerrard's face on BT Sport when Warnock joked that they don't have windows in Liverpool  pic.twitter.com/w9JdVVKbyR,/TheFutbolFeed/status/821853869588316160,TheFutbolFeed,1061.33333333
844719825297559552,1920,19,1025,"""Baseball isn't a contact sport""  pic.twitter.com/ubwVBHafqX",/BsbLifestyle__/status/844719825297559552,BsbLifestyle__,988.0
798671454598467584,1906,19,913,"Didn't play the same sport, but do rep the same town. Wish I could've been Tony's teammate. That's the best compliment I can give.",/MikeyY626/status/798671454598467584,MikeyY626,946.0
873871183648702469,1473,33,982,Zlatan Ibrahimović is set to join MLS side LA Galaxy following his release by Manchester United. (Source: Sun Sport) pic.twitter.com/wRKSdJn51J,/DeadlineDayLive/status/873871183648702469,DeadlineDayLive,829.333333333
789828657996967936,1359,8,992,"Ronaldinho shows off his tekkers in the new 'Teqball' Olympic sport. 
pic.twitter.com/5480YybN1K",/FootballVines/status/789828657996967936,FootballVines,786.333333333
844726183476576256,1453,2,886,Why I love this sport.  https://twitter.com/mikesanz19/status/838803982411759619/video/1 …,/FootyVines/status/844726183476576256,FootyVines,780.333333333
717498694778662912,1128,22,427,"Breanna Stewart has been at the top of the college game for 4 years, but the sport did not always come easy to her. http://es.pn/1WaOq2E ",/SportsCenter/status/717498694778662912,SportsCenter,525.666666667
833414662150459392,1103,167,241,Let's fight childhood obesity by making weekend sport registrations tax deductible. Can't believe how expensive it is for parents. Thoughts?,/kochie_online/status/833414662150459392,kochie_online,503.666666667
795762799880376320,666,10,532,Retweet if your favorite sport is choking to death.,/Lamp/status/795762799880376320,Lamp,402.666666667
813143600708120576,767,19,416,"Hello, basketball is the best sport.",/SeanFennessey/status/813143600708120576,SeanFennessey,400.666666667
888517849999974400,662,2,309,"""Soccer is a non contact sport"" 

Me... pic.twitter.com/mTBqRwchdh",/TheFifaWorIdCup/status/888517849999974400,TheFifaWorIdCup,324.333333333
810265924209025024,664,20,248,Two weight UFC champion Conor McGregor is the 2016 RTÉ Sport Person of the Year. #rtesportawardshttp://snpy.tv/2hHcmLS ,/RTEsport/status/810265924209025024,RTEsport,310.666666667
929136564378193920,96,18,623,"
Dear FIFA
I would like to draw your attention to what's going on currently in Saudi football association with the government interference, alahli club was given a decision by the sport court about legality of the transfer of Mohammed alowais
@FIFAcom
#كأس_العالم_حيوحشنا",/abduljawadrafat/status/929136564378193920,abduljawadrafat,245.666666667
685604366695424000,427,0,308,"George is 9 and has cerebral palsy.

But that doesn't stop him from playing the sport he loves! #Respecthttps://amp.twimg.com/v/7be0e96c-30c4-4431-b367-9368d4a8a6c1 …",/FootyVines/status/685604366695424000,FootyVines,245.0
899745492686516225,387,22,246,Golf is a fun relaxing sport pic.twitter.com/sqc0hhQ6Dk,/Golfing_Daily/status/899745492686516225,Golfing_Daily,218.333333333
766766037647982592,496,8,130,Amazing scenes for @_GBHockey and @TeamGB women's - everyone a credit to their sport & all looked so athletic & handled pressure brilliantly,/CliveWoodward/status/766766037647982592,CliveWoodward,211.333333333
873920256368156672,440,54,58,"For sport, here's my whack at a 25 films of the 21st: pic.twitter.com/IYjmI9rD6v",/Glenn__Kenny/status/873920256368156672,Glenn__Kenny,184.0
891376865482481664,427,5,67,"A good sport about it all. 

#GERDEN #WEURO2017pic.twitter.com/aDYGb1t2Uh",/AnnOdong/status/891376865482481664,AnnOdong,166.333333333
844870469153161216,284,2,174,"Any athlete is blessed to play an NCAA sport regardless of division. Also goes to show nothing comes easy, those are some real small numbers pic.twitter.com/XoEOSUxtAt",/jack_stevens13/status/844870469153161216,jack_stevens13,153.333333333
758068544051539968,154,30,261,Gazzetta dello Sport and Corriere dello Sport says it's only a question of hours before Pogba joins United,/hashim0307/status/758068544051539968,hashim0307,148.333333333
847848442600796160,271,7,73,"Two new Renault Sport Academy recruits! Welcome Christian & Marta 

http://rsport.me/ff97bb pic.twitter.com/TZ20O26DJR",/RenaultSportF1/status/847848442600796160,RenaultSportF1,117.0
847946621849612288,222,1,116,Being able to suite up and play my sport is such a blessing ,/AthCenter/status/847946621849612288,AthCenter,113.0
952328930421362688,231,76,17,"If you think Van Dijk should take the armband then you don't understand sport

Playing at a high level which i did in footy, If some new guy just came in & was given the armband id be pretty pissed

I know it just seems natural to give him it as he acts like it but its too soon https://twitter.com/AnythingLFC_/status/952326556692766720 …",/AnythingLFC_/status/952328930421362688,AnythingLFC_,108.0
711019545595682816,80,2,201,"QC Beningfield AR (left) presents  #sport project to DRC Embassy 'Head of Mission', Ms Marie-Louise Kafenge Nanga pic.twitter.com/IXbuxLf3lj",/sportcareaccess/status/711019545595682816,sportcareaccess,94.3333333333
932035144696901632,216,8,41,"Baker Mayfield was being Baker Mayfield. Imagine being a passionate 22 yo being disrespected & you get caught up in the moment. I'm just proud he didn't throw a punch. Football isn't croquet. This sport is intense. If you're easily offended, maybe find something else to watch.",/bfsooner/status/932035144696901632,bfsooner,88.3333333333
691405155439353856,174,0,88,"Person: “Cheer isn’t even a sport”
Me: “dismiss yourself...the door is right there” pic.twitter.com/bdhmG5G2gj",/Its2017Seniors/status/691405155439353856,Its2017Seniors,87.3333333333
726152856403861504,147,18,81,FINAL SCORE @safc 1-2 @MarineAFC - THE MARINERS ARE THE INTEGRO DOODSON SPORT CUP WINNERS 2015/2016!!!!!! ,/MarineAFC/status/726152856403861504,MarineAFC,82.0
905875750343061504,129,16,79,Chelsea News: Marina Granovskaia wants Antoine Griezmann to make up for transfer failings #CFChttp://www.express.co.uk/sport/football/851347/Chelsea-News-Marina-Granovskaia-Antoine-Griezmann-Atletico-Madrid-Diego-Costa-transfers …,/DExpress_Sport/status/905875750343061504,DExpress_Sport,74.6666666667
763764734390697984,109,3,92,"#AlexaMoreno shows that body type should not matter in a sport, as long as there is the discipline and love for it anything  is possible ",/MariposaWarrior/status/763764734390697984,MariposaWarrior,68.0
862179209581477889,111,7,84,[dare] summarise your favourite sports anime without directly mentioning the sport pic.twitter.com/xZxYImzY4O,/kiyala/status/862179209581477889,kiyala,67.3333333333
830471646280429568,147,16,32,"If you are going to be pro life, then at the very least advocate for ALL lives. This animal was only killed for sport.  https://twitter.com/johnfugelsang/status/830457578186534912 …",/Chrishell7/status/830471646280429568,Chrishell7,65.0
717459705594036226,108,0,83,"Never Give Up. Nunca Desistir. We are Sport Lisboa e Benfica and here to support you, always. pic.twitter.com/Rpd6ICGzef",/planetbenfica/status/717459705594036226,planetbenfica,63.6666666667
705896876927795200,92,0,83,Being the last pick for a sport like https://vine.co/v/i6dYiwlgaZU ,/WorIdStarVine/status/705896876927795200,WorIdStarVine,58.3333333333
871148318289780736,105,1,58,"Cristiano Ronaldo has now scored 600 career goals:

• Real Madrid (406)
• Manchester United (118)
• Portugal (71)
• Sporting CP (5)pic.twitter.com/O4oPNAAV9F",/RMadridHome_/status/871148318289780736,RMadridHome_,54.6666666667
731997107729534976,127,1,34,Right on point about dual sport athletes @burticus21 breaks 14 to get 2nd in Big 12 today! #Texasfastpic.twitter.com/7byVC9B3bA,/CoachTraylor/status/731997107729534976,CoachTraylor,54.0
731997458415288320,125,2,27,Love the sport and can't decide on a team? Now introducing our new hockey lace hoodies http://bit.ly/1N3Niq9 pic.twitter.com/JanTmhBTA8,/EHClothing/status/731997458415288320,EHClothing,51.3333333333
961026498495897600,109,7,27,Snow volleyball might be coming to the Winter Olympics — which would make it the first sport in both the Summer and Winter games pic.twitter.com/M1jsGBBMA3,/nowthisnews/status/961026498495897600,nowthisnews,47.6666666667
723202514158411776,28,47,56,"  CONTEST
Dr. J? MJ?  RT & Post your favorite #TBT moment (any sport) --we'll pick two users randomly to win $25! pic.twitter.com/29F2BhPXOl",/FanDuel/status/723202514158411776,FanDuel,43.6666666667
700087392947064832,65,3,60,Pic: Cristiano was onside before scoring his goal tonight pic.twitter.com/PhV6rrWs7g [@Don_fhd via beIN Sport],/RMadridInfo/status/700087392947064832,RMadridInfo,42.6666666667
752290953751322625,70,1,45,"‘We were as simple as doves, and wise as serpents’: Santos toasts #Por #Euro2016 triumph http://gu.com/p/4zg29/stw pic.twitter.com/qpqIgP9IB9",/guardian_sport/status/752290953751322625,guardian_sport,38.6666666667
714602966611677185,66,1,47,Motocross is more than just a sport.. It's a lifestyle and a getaway from reality  pic.twitter.com/Oa7Dwt0Ms5,/RecklessMX422/status/714602966611677185,RecklessMX422,38.0
859546280988737537,76,3,30,‘Unique’ Cristiano Ronaldo benefits from Zinedine Zidane’s guidance @sidlowehttps://www.theguardian.com/football/2017/may/02/cristiano-ronaldo-real-madrid-zinedine-zidane-quotes?CMP=share_btn_tw …,/guardian_sport/status/859546280988737537,guardian_sport,36.3333333333
839136087247306753,67,4,34,Hope for Arsenal: how Partizan Belgrade put QPR out of Europe after losing the first-leg 6-2 at Highburyhttps://www.theguardian.com/football/that-1980s-sports-blog/2017/mar/07/partizan-belgrade-highbury-qpr-uefa-cup-europe …,/guardian_sport/status/839136087247306753,guardian_sport,35.0
839234606041714688,14,3,86,RT to win! #NZvSA 1st Test odds here: http://bit.ly/2lZN8cX pic.twitter.com/UAdxbhjLo6,/TAB_Sport/status/839234606041714688,TAB_Sport,34.3333333333
714443288107814914,56,10,34,Lace up with JT for the Rainbow Round of Sport 31/3-4/4. FREE #RainbowLaces at @rebelsport and @amartsportspic.twitter.com/HhUAwGraLB,/SKINSAU/status/714443288107814914,SKINSAU,33.3333333333
772582496789729281,73,4,23,Imagine your favorite announcers of yesteryear calling your sport today. That's what @NASCARonNBC is doing right now. Love this.,/jaybusbee/status/772582496789729281,jaybusbee,33.3333333333
778382528545632257,44,0,52,Eating is probably my favorite sport.,/PinoyHugotPosts/status/778382528545632257,PinoyHugotPosts,32.0
856530337433763840,49,0,45,Basketball > Any other sport,/BallersDesire/status/856530337433763840,BallersDesire,31.3333333333
903015466775580681,50,11,31,"Chelsea to target Llorente, Barkley and Drinkwater on deadline day. By @domfifieldhttps://www.theguardian.com/football/2017/aug/30/chelsea-llorente-barkley-drinkwater-deadline-day?CMP=share_btn_tw …",/guardian_sport/status/903015466775580681,guardian_sport,30.6666666667
763828089000460288,40,1,43,#UniAdvice There is MORE TO LIFE THAN ACS. Join other societies or take up a new sport you might be hella talented at it,/_seyeakin/status/763828089000460288,_seyeakin,28.0
894346611031248897,60,4,19,Barcelona have made a final offer worth €90m + bonuses for Coutinho. [SPORT],/CatalanEdition/status/894346611031248897,CatalanEdition,27.6666666667
810272653944688645,58,0,22,wouldn't trade my team and our passion for this sport for ANYTHING. We left it all on the mat and that's all I could've ever asked for #CHDTpic.twitter.com/kUExNUd78F,/KaitlynHarriso3/status/810272653944688645,KaitlynHarriso3,26.6666666667
897245094595702784,42,1,33,"No more administrative corruption , No more neglect "" La Masia "" , We want a real sport project not economic !! #BartomeuDimiteYapic.twitter.com/8KoBciuhgO",/i3ei_/status/897245094595702784,i3ei_,25.3333333333
830566036592328704,63,3,9,New || @SaraSampaio for Victoria's Sport  pic.twitter.com/WvV301vXlE,/MyAngelSaraS/status/830566036592328704,MyAngelSaraS,25.0
859538419520819200,69,2,4,This is literally how teams in every professional sport with a clock ends games they're ahead in.,/aaronshapiro/status/859538419520819200,aaronshapiro,25.0
911741742403276800,41,0,33,#Invictus Sport Games played by true America heroes who sacrificed their lives to defend/protect #NFL elites players for less than 50k yrpic.twitter.com/YiRZihvrlS,/PatrioticCindy/status/911741742403276800,PatrioticCindy,24.6666666667
961388434953723904,68,1,5,"Celebrating National Girls & Women in Sport Day!  They continue to inspire the future generations, like my daughter, to be strong, confident, and fierce.  #NGWSD @WomensSportsFdn @PTStandTogether #slamdunkpic.twitter.com/Bu3z1dfd9l",/natborchers/status/961388434953723904,natborchers,24.6666666667
697208155734933505,24,4,44,"Manchester City, Barcelona and Bayern Munich are ready to battle it out for the signature of Paulo Dybala. [Sport] pic.twitter.com/vi9nnpYhLl",/City_Chief/status/697208155734933505,City_Chief,24.0
836355858053353474,36,1,34,soccer is the best sport in the world,/kinglouis08/status/836355858053353474,kinglouis08,23.6666666667
760988386203168768,50,0,16,Phelps: “I Don’t Know If I’ve Ever Competed In A Clean Sport” http://swimsw.am/xuz pic.twitter.com/O5LTIlj78W,/swimswamnews/status/760988386203168768,swimswamnews,22.0
961025954805100544,49,5,11,"Swin Cash, Steve Mills, Scott Perry, & Craig Robinson are now live discussing breaking barriers & exploring diversity in sport pres. by @adidas #BHM 

Watch: http://bit.ly/2ErkCh6 pic.twitter.com/qWZJfhgSXA",/nyknicks/status/961025954805100544,nyknicks,21.6666666667
894346751880159232,44,4,11,Exclusive - Neymar decided to leave months ago. [SPORT],/CatalanEdition/status/894346751880159232,CatalanEdition,19.6666666667
717475814019842048,21,5,31,Bayern Munich's Alaba really wanted to play for Arsenal instead. #AFChttp://sportwitness.ning.com/forum/topics/bayern-munich-star-s-dream-to-sign-for-arsenal-idol-is-patrick-vi …,/Sport_Witness/status/717475814019842048,Sport_Witness,19.0
711696404394205184,27,0,28,"Track is such a mental and physical sport. You can have a horrible season(s) but you can't let that get you down, you gotta keep working",/kiana_bekoolin/status/711696404394205184,kiana_bekoolin,18.3333333333
961388317999681537,37,3,15,"Welcome to South Korea. Our Olympic coverage kicks off tonight with Olympic Games Prime Time with @CBCScottRussell. A new sport makes its debut - Curling Mixed Doubles. Watch it here: https://olympics.cbc.ca/video/whats-on-tv/olympic-prime-time-cbc-featuring-curling-mixed-doubles/ …
#PyeongChang2018, 
#UpWithCBC
#CBCOlympicspic.twitter.com/2rc0C9OzPp",/CBCOlympics/status/961388317999681537,CBCOlympics,18.3333333333
756174017497800704,27,2,25,"""Cheerleading isn't a sport"" pic.twitter.com/3iTzedS6cp",/taylerjanae/status/756174017497800704,taylerjanae,18.0
952328892458479616,45,3,4,"God bless straight boys and their insta stories. A poorly lit photo of beers! New sport shoes! Any view at all... an upward shot of the cn tower, their backyard on a snowy morn! No location no stickers not even a filter they don’t even USE ANGLES just one snap and posted!! Unreal",/ivanatweets2u/status/952328892458479616,ivanatweets2u,17.3333333333
804475161244270592,26,0,25,"If blazing was a sport, damn.... I'd be in the Olympics.",/welovingkush/status/804475161244270592,welovingkush,17.0
862457174995247104,40,3,8,"Toles said injuries are part of the sport. No sense in being distraught, he said.",/kengurnick/status/862457174995247104,kengurnick,17.0
752290050696589312,35,2,13,#USGA Women's Open In what other major sport can a penalty be called after play has continued. Not fair to the golfers and the fans.,/Jerry_YBW/status/752290050696589312,Jerry_YBW,16.6666666667
853688378029744129,32,0,18,#pics from #6hSilverstone http://bit.ly/2p3eQe9  #WECpic.twitter.com/ZesgMegDAI,/Michelin_Sport/status/853688378029744129,Michelin_Sport,16.6666666667
766692682441723904,8,0,41,"#Brunch, a full contact sport w/ @CarolineArtiss https://youtu.be/bxU1XL0Y8nw3  #mimosas #Bubblensqueak @MelissasProduce @tonyspats @tastemade",/GetDish/status/766692682441723904,GetDish,16.3333333333
821869354702831616,18,1,30,NEW GEEZ TRACK 'SATISFIED/SPORT' . PLAY THAT FOR ME ONE TIME https://soundcloud.com/hunidgeez/satisfiedsport …,/1WanGeez/status/821869354702831616,1WanGeez,16.3333333333
763887707793788929,17,2,29,Kickball also needs to be an Olympic sport,/CuffsTheLegend/status/763887707793788929,CuffsTheLegend,16.0
920439141317447680,25,20,1,Basketball is the worst sport,/Atrios/status/920439141317447680,Atrios,15.3333333333
784180914003648512,37,1,6,One last go round with the sport that has given me so much  #lastyearBESTyearpic.twitter.com/HMvTF6kCHN,/Carolineseitz/status/784180914003648512,Carolineseitz,14.6666666667
914640468549492736,30,10,4,Seriously when did Darts became a sport? The hardest thing they do is swig down 23 pints of Newkie Bruwn Ale,/IanMFish/status/914640468549492736,IanMFish,14.6666666667
920439037571338240,42,0,1,Thank you for teaching me how to play the sport right and being a man. I’ll see you one day. Rest easy brotha  #PrayforBlakepic.twitter.com/etpbr3upjs,/petey_ridley/status/920439037571338240,petey_ridley,14.3333333333
923338017804206080,14,29,0,you guys should try and guess what sport i just studied 36 pages of.... ,/MireikaEdwards/status/923338017804206080,MireikaEdwards,14.3333333333
775483965339676672,32,5,5,happy #nationalcheerleadingday !! so blessed to do the sport i love most for the past 16 years and still going  pic.twitter.com/eeq6sFgz0A,/KkCharon/status/775483965339676672,KkCharon,14.0
700107314791985152,35,1,4,"since tryouts start Monday, why not post one of my senior pics w/ my fav sport pic.twitter.com/XhMV9AIQaV",/_Meeegann/status/700107314791985152,_Meeegann,13.3333333333
958127028531859461,27,4,9,"RIGHT NOW: Voting YEA on the Protecting Young Victims from Sexual Abuse and Safe Sport Authorization Act of 2017. We must do all we can to protect the nation's children from predators. If adults see something, they must say something.",/repdinatitus/status/958127028531859461,repdinatitus,13.3333333333
720400777852923904,34,0,4,When someone says vaping isn't a sport pic.twitter.com/JvYKSyJQtt,/BeasleyThree/status/720400777852923904,BeasleyThree,12.6666666667
824768503190261760,26,0,12,One bad coach can ruin everything about a sport,/itsadddie/status/824768503190261760,itsadddie,12.6666666667
781282155141804032,27,1,8,Pregame broadcast is on for @Huskervball vs Illini. Listen N @HuskerSports @JB_Prep ...Biggest pep band ever for an indoor sport! #earshurtpic.twitter.com/dQktt5iPtQ,/DSMendenhall/status/781282155141804032,DSMendenhall,12.0
850860377386647552,17,0,19,This Nigga playing the wrong sport with that baseball slide pic.twitter.com/trkec7TOFw,/whoisrayraf/status/850860377386647552,whoisrayraf,12.0
932035635321253888,23,1,11,"Extract from my @WisdenCricket interview with Steve Smith in Sunday’s Observer, via @guardian_sport: https://www.theguardian.com/sport/2017/nov/18/steve-smith-australia-captain-ashes-england … #Ashespic.twitter.com/1tJG829Sqa",/collinsadam/status/932035635321253888,collinsadam,11.6666666667
795777816486957056,32,1,1,no that's against the law. Can only be a fan of one team per sport. Section 13A-12-1,/AndrewPiquette/status/795777816486957056,AndrewPiquette,11.3333333333
856658841575936000,23,1,9,two sport athletes. Baseball is the common game. Brennan Davis on the court and Ty sifferman on the gridiron @ctownrivals @BashaAthleticspic.twitter.com/1GenE5xMNH,/brettinaz/status/856658841575936000,brettinaz,11.0
961026178936197120,31,1,1,One of my absolute favorite parts of this sport—the amazing people who share this passion of… https://www.instagram.com/p/Be399mLlYyK/ ,/emily_infeld/status/961026178936197120,emily_infeld,11.0
723299881209749504,28,0,4,"This is the end. It was a fun season! Put the work in and had a great year, despite the injuries. Love the sport, love my team.",/cobychambliss/status/723299881209749504,cobychambliss,10.6666666667
734896488686489600,20,1,11,Since @Sport_Guy7 likely left Twitter for a bit again we will be continuing the #SportsCommunity. Follow us and we will help you gain.,/FollowGainBRUH/status/734896488686489600,FollowGainBRUH,10.6666666667
734896032404897792,22,0,10,"Dorsey freshman Kayvon Thibodeaux, a three-sport athlete, has been offered by Washington State. Defensive end.",/latsondheimer/status/734896032404897792,latsondheimer,10.6666666667
